{
  "id": "89105c06-dbdb-4aa0-9695-d4d19c733270",
  "requestType": "Recall",
  "requestDate": "2017-07-29T22:25:37Z",
  "requesterId": "21932a85-bd00-446b-9565-46e0c1a5490b",
  "holdingsRecordId": "e63273e7-48f5-4c43-ab4e-1751ecacaa21",
  "instanceId": "86c722c3-2f5e-42e1-bd0e-7ffbbd3b4972",
  "requestLevel": "Item",
  "itemId": "195efae1-588f-47bd-a181-13a2eb437701",
  "fulfilmentPreference": "Hold Shelf",
  "requestExpirationDate": "2017-07-25T22:25:37Z",
  "position": 1,
  "instance": {
    "title": "Children of Time"
  },
  "item": {
    "barcode": "760932543816"
  },
  "tags": {
    "tagList": [
      "new",
      "important"
    ]
  }
}
